question	category	word	correct_option	options
Fill the gaps:  If a number of people consider themselves one group based on location, work, religion, nationality, or even activity, they can be called a ______. If you like to play online games, you are active in the gamer ______.	medium	community	3	['potential', 'invest', 'culminate', 'community']
Fill the gaps:  A ______ is a location. The leader of a Zombie Army might remind his underlings: “Your web ______ is just a collection of pages at one address on the Web. Your burial ______ is where you find more soldiers!”	medium	site	0	['site', 'extract', 'deter', 'crude']
Fill the gaps:  Another word for formally discuss is ______. Cheese lovers often ______ the merits of gorgonzola, triple creme brie, and gouda. Of course, they need to accompany their arguments with a taste test!	medium	debate	1	['authority', 'debate', 'enable', 'complement']
Fill the gaps:  A ______ is a part you play. In school, you might take on the ______ of clown, in your family, the ______ of the responsible one, on stage, the ______ of Juliet.	medium	role	2	['secure', 'trigger', 'role', 'internal']
Fill the gaps:  A ______ is a struggle or an opposition. If you and your best friend both fall in love with the same person, you will have to find some way to resolve the ______.	medium	conflict	3	['complement', 'prior', 'internal', 'conflict']
Fill the gaps:  To be ______ means to know about. If you're ______ of a sled zooming towards you, move! And if you’re ______ that the other kids wish they had sleds, share yours. That’s being socially ______. Well done.	medium	aware	0	['aware', 'convey', 'debate', 'consent']
Fill the gaps:  If you have a ______ that you can swim across the ocean, you are probably wrong. A ______ is an idea, often vague and sometimes fanciful.	medium	notion	2	['disparate', 'element', 'notion', 'obscure']
Fill the gaps:  A rough calculation or appraisal is an ______. When you hit another baseball through the kitchen window, your parents will get an ______ of the repair costs. And you should ______ being grounded for approximately 3 weeks.	medium	estimate	1	['downfall', 'estimate', 'deter', 'tint']
Fill the gaps:  An ______ is something basic and important––in chemistry, an ______ is one of the essential molecules that everything else is made of.	medium	element	3	['provided', 'hazard', 'resent', 'element']
Fill the gaps:  ______s are longstanding customs and practices. It might be a family ______ to open Christmas presents on Christmas Eve, started because your parents were too impatient to wait.	medium	tradition	3	['inclination', 'widespread', 'slender', 'tradition']
Fill the gaps:  To ______ means to uncover or allow to be in the open air. If you take off your coat and ______ your bare arms to the terrible cold, your tattoos might freeze off. (Note: We don’t actually know if this is physically possible.)	medium	expose	2	['complementary', 'slender', 'expose', 'momentum']
Fill the gaps:  When you ______ something, you make sense of it. You could ______ a graph, a foreign language, or even Mona Lisa's odd smile.	medium	interpret	2	['preemptive', 'potential', 'interpret', 'consent']
Fill the gaps:  To ______ means to go or continue forward. But somehow "ready, set, ______!" doesn't quite have the same ring to it.	medium	proceed	1	['role', 'proceed', 'endeavor', 'complement']
Fill the gaps:  To ______ something is to provide a part of the whole. When your company has their annual softball game and potluck picnic, you will probably be asked to ______ a dish, like your famous macaroni salad.	medium	contribute	3	['complementary', 'foe', 'extract', 'contribute']
Fill the gaps:  Use the adjective ______ to describe something that is large in amount. Things you probably spend a ______ amount of time on: homework and laundry. Things you'd rather spend time on: anything that isn't homework and laundry!	medium	considerable	1	['migrate', 'considerable', 'role', 'perpetual']
Fill the gaps:  ______ the verb and ______ the noun are very similar in meaning. A ______ is a change in something or an adjustment in the way something is done. You can either make a ______ (that's the noun), or you can just ______ (that's the verb).	medium	shift	0	['shift', 'extinct', 'deter', 'convoluted']
Fill the gaps:  If you're tired of the same old breakfast of bran flakes and orange juice, ______ your routine—put some banana slices on those bran flakes. You can ______ the routine by changing the details but keeping the basics the same.	medium	vary	3	['concentrate', 'obtain', 'aware', 'vary']
Fill the gaps:  The first letter of your name is your ______. The first thing you say to someone is your ______ greeting. ______ is something that occurs first or at the beginning.	medium	initial	0	['initial', 'vast', 'overwhelm', 'consent']
Fill the gaps:  Generally you should eat dinner ______ to brushing your teeth. Use the adjective ______ for things that exist earlier in time or that happen first in time or order.	medium	prior	3	['regulate', 'conflict', 'disperse', 'prior']
Fill the gaps:  A ______ is something that helps you, whether in the form of health insurance provided by an employer, welfare given by the government to those in need, or the ______ of the doubt extended to you by a friend.	medium	benefit	3	['vast', 'notion', 'prior', 'benefit']
Fill the gaps:  If you can describe something as possible but not yet actual, choose the adjective ______. Companies try to reach ______ customers through advertising.	medium	potential	1	['administration', 'potential', 'enable', 'distribute']
Fill the gaps:  The noun ______ describes a thin piece that's stacked on other thin pieces, like a ______ of noodles in a lasagna dish. You can also apply a ______ of paint to make your wall color more vivid.	medium	layer	2	['coherent', 'abrupt', 'layer', 'alternative']
Fill the gaps:  The noun ______ means the study of proper behavior, and the search for wisdom.	medium	philosophy	0	['philosophy', 'invest', 'protocol', 'elegant']
Fill the gaps:  When something ______, it goes downhill. If you stop working out, your health may ______. If you want it to improve, you should start climbing inclines instead of coasting down ______.	medium	decline	0	['decline', 'provided', 'stunning', 'eccentric']
Fill the gaps:  Use the word ______ to describe the group of people running an organization: “University ______ declared Wednesday a snow day and sent everyone home early.”	medium	administration	3	['internal', 'stable', 'obscure', 'administration']
Fill the gaps:  Although the word ______ seems to suggest tough, physical work that makes you sweat, any type of work, whether physical or mental, can be considered ______.	medium	labor	1	['constraint', 'labor', 'devoid', 'abundant']
Fill the gaps:  Before it was the universal word for traveling around the Internet, ______ was just a connection or a device that connects things, like the ______s in a chain.	medium	link	0	['link', 'distribute', 'demolish', 'bulky']
Fill the gaps:  When you ______, you put time or money into something, hoping that there will be returns greater than what was originally put in.	medium	invest	3	['hierarchy', 'provided', 'prior', 'invest']
Fill the gaps:  If two things are basically the same, you can say that they're the ______ of each other.  Like, studying advanced physics is the ______ of banging your head against the wall.	medium	equivalent	1	['complement', 'equivalent', 'abrupt', 'secure']
Fill the gaps:  A ______ is any interconnected system. The Internet is a ______ of computers all talking to one another. A subway is a ______ of interconnected train lines running underneath the city.	medium	network	3	['obtain', 'robust', 'behalf', 'network']
Fill the gaps:  ______ means strictly correct or very exact. If you need something to be ______, like the positioning of a safety net for a stunt jump over a canyon, there's no room for error.	medium	precise	2	['persevere', 'downfall', 'precise', 'absent']
Fill the gaps:  When two things _____, they match up or are equivalent to one another. You might come up with a code in which numbers _____ to letters of the alphabet. _____ can also mean to send messages back and forth. You can _____ with your friend.	medium	correspond	2	['resent', 'conform', 'correspond', 'tint']
Fill the gaps:  When something is ______, it is easily identifiable or set apart from others of its kind.  An eighth-grader who is six feet tall has a ______ advantage over the other kids on the basketball court.	medium	distinct	1	['debate', 'distinct', 'rigid', 'obscure']
Fill the gaps:  The adjective ______ describes something on the inside. If you're tempted by a second piece of cake, you may have an ______ battle with yourself over whether you should eat the cake or not.	medium	internal	0	['internal', 'coincide', 'endeavor', 'controversial']
Fill the gaps:  The place where you live — whether house, hotel, or mobile home — is where you ______. The President of the United States ______ in a little shack called the White House.	medium	reside	2	['gratify', 'estimate', 'reside', 'tint']
Fill the gaps:  When something is ______, it happens once a year. An ______ holiday party should be a time for fun, but it also can be a sad yearly reminder of the passage of time.	medium	annual	0	['annual', 'downfall', 'invest', 'emit']
Fill the gaps:  If someone wants to know the ______ of something, they want to know what condition it's in, where it is, or how much progress it's made. You've probably checked the ______ of your flight to see if it's on time or delayed.	medium	status	3	['complementary', 'aware', 'internal', 'status']
Fill the gaps:  An ______ is somewhere between a belief, a stance, a mood, and a pose. If you've got an ______ about something, it can be hard to change it because you think you're right.	medium	attitude	2	['site', 'impending', 'attitude', 'trigger']
Fill the gaps:  To ______ is to disperse widely, hand out, or spread around. While you're still snoozing, the paper boy is busy distributing the newspaper all over the neighborhood.	medium	distribute	3	['authority', 'deter', 'durable', 'distribute']
Fill the gaps:  If you have the ______ to do something, you have the right or power to do it. You are the big cheese. Or, if you know more about a topic than most, you are an ______ on that topic.	medium	authority	1	['attitude', 'authority', 'estimate', 'specimen']
Fill the gaps:  When something is ______, it's fixed and steady. If you needed advice, you'd probably go to your most ______ friend, the one least likely to act crazy or be easily upset.	medium	stable	3	['demolish', 'annual', 'persist', 'stable']
Fill the gaps:  When you make something possible, you ______ it. Your good grades might ______ you to get into your first-choice college. And a great teacher ______d you to get such good grades.	medium	enable	3	['extinct', 'inclination', 'obscure', 'enable']
Fill the gaps:  ______ means safe, protected. Your money is ______ in a bank. Supportive friends and family make you feel ______.	medium	secure	1	['expose', 'secure', 'shimmer', 'accumulate']
Fill the gaps:  ______ means to make something stronger, denser, or more focused. If you ______ your energy, for example, you become more powerful! ______ your efforts at digging, and you'll plant that shrub a lot faster.	medium	concentrate	0	['concentrate', 'aware', 'provoke', 'consent']
Fill the gaps:  ______ means to support something or keep it going. If you get hungry in the mid-afternoon, you might try snacking to ______ your energy through dinner.	medium	sustain	1	['impede', 'sustain', 'resent', 'defiant']
Fill the gaps:  The on-off spigot ______s the flow of water into your bathtub. When a government ______s an industry, they set standards the industry must follow. To ______ means to impose control.	medium	regulate	3	['rigid', 'foe', 'shimmer', 'regulate']
Fill the gaps:  An ______ is a quality or characteristic given to a person, group, or some other thing. Your best ______ might be your willingness to help others, like when you stopped traffic so the duck family could cross the street.	medium	attribute	1	['distort', 'attribute', 'perpetual', 'warp']
Fill the gaps:  The word ______ refers to a variety of things or to an area in which something operates. The store offers the living room set in a ______ of colors. What's the ______ of that remote-controlled airplane?	medium	range	2	['extinct', 'precise', 'range', 'internal']
Fill the gaps:  When you're facing a fork in the road, you have two possibilities, or ______s. You could take the left fork and see where it leads, or you could choose the path that goes to the right.	medium	alternative	1	['decline', 'alternative', 'obscure', 'preemptive']
Fill the gaps:  An ______ is a period of time distinguished by a particular character. “It was the Eisenhower ______, when people were more willing to serve in the military.”	medium	era	0	['era', 'complementary', 'aware', 'proceed']
Fill the gaps:  Describe something as ______ if it's really stiff and not very flexible, like a super-strict practice schedule or an unbending, uncomfortable mattress.	medium	rigid	2	['slender', 'robust', 'rigid', 'impede']
Fill the gaps:  An ______ (AD-və-kit) is someone who supports a cause, like an ______ for outdoor recess. ______ (AD-və-kate) is also a verb meaning to speak in favor of, so you can ______ for that outdoor recess by urging your school to play outside!	medium	advocate	0	['advocate', 'prior', 'alternative', 'status']
Fill the gaps:  When you ______ something, you move it to a new position — either in a concrete sense, like moving a chair, or in an abstract sense, like firing someone from a job.	medium	displace	0	['displace', 'coherent', 'emit', 'proceed']
Fill the gaps:  Something that's ______ doesn't work quite right, because it's damaged in some way. Your ______ car probably won't make it all the way to California from New York.	medium	defective	3	['authority', 'controversial', 'momentum', 'defective']
Fill the gaps:  When someone ______s they keep going or hang on. If you want finish a marathon, you have to ______ and keep running, no matter how many blisters you have.	medium	persist	1	['extinct', 'persist', 'slender', 'disparate']
Fill the gaps:  A ______ is a shade or type of color. You might describe ocean water during a storm as having ______s of green and gray.	medium	tint	2	['gratify', 'attribute', 'tint', 'complementary']
Fill the gaps:  A ______ is something that makes up a satisfying whole with something else. Those shiny red shoes you just bought ______ your shiny red purse.	medium	complement	0	['complement', 'labor', 'foe', 'contribute']
Fill the gaps:  A ______ is a little leftover bit of something. You might jot down notes on a ______ of paper, or you might toss a ______ of food to your happy dog.	medium	scrap	2	['coherent', 'element', 'scrap', 'notion']
Fill the gaps:  Nimble ballerinas and long-legged birds are ______; dump trucks and walruses usually are not.	medium	elegant	2	['hazard', 'impartial', 'elegant', 'advocate']
Fill the gaps:  When you ______ something, you carry or deliver it. Little Red Riding Hood ______ed a basket of muffins to her grandmother. Your sad smile might ______ more about your feelings than words ever could.	medium	convey	0	['convey', 'foster', 'obscure', 'labor']
Fill the gaps:  A ______ is a sample of something, like a ______ of blood or body tissue that is taken for medical testing.	medium	specimen	0	['specimen', 'momentum', 'ambiguous', 'foe']
Fill the gaps:  To ______ means to gather, usually in large quantities. Let's hope your boyfriend is not the type to ______ girlfriends.	medium	accumulate	3	['roam', 'defective', 'integral', 'accumulate']
Fill the gaps:  If something is ______, there isn't much of it around. Crops are ______ after a long drought, or you might find babysitters ______ if your kids are a nightmare to watch.	medium	scarce	2	['vary', 'constraint', 'scarce', 'benefit']
Fill the gaps:  Anything that brings about a strong reaction can be said to ______. You can ______ that lion if you want. But if he responds by attacking, don't come running to me.	medium	provoke	3	['range', 'extract', 'precise', 'provoke']
Fill the gaps:  ______ means “give a person too much of something.” If your friend agrees to feed your pet fish while you’re on vacation, don’t ______ her with requests by also asking her to do your laundry and wash the dishes.	medium	overwhelm	2	['attribute', 'enable', 'overwhelm', 'stable']
Fill the gaps:  If something is ______, it's intricate and hard to understand. You'll need to read over your brother's ______ investment scheme a few times before deciding whether or not to go in on it.	medium	convoluted	1	['deter', 'convoluted', 'expose', 'hazard']
Fill the gaps:  Choose the adjective ______ to describe something you are unsure or hesitant about. On Monday, you can make ______ plans for the weekend, but it's too early to commit to one party or another.	medium	tentative	2	['compel', 'role', 'tentative', 'bulky']
Fill the gaps:  ______ means not there. If you ______ yourself from class, you're marked as ______. If you have an ______ parent, it means they don't live with you or take part in your care.	medium	absent	1	['secure', 'absent', 'hazard', 'community']
Fill the gaps:  A ______ is a dispute or argument in which people express strong opposing views. When a popular TV show kills off a well-loved character, there's bound to be a lot of ______.	medium	controversy	0	['controversy', 'conflict', 'shimmer', 'via']
Fill the gaps:  The verb ______ is used to describe a high point or a climactic stage in a process. For example, the goal of a Major League baseball team is to have their season ______ in a World Series victory.	medium	culminate	0	['culminate', 'provoke', 'controversial', 'consent']
Fill the gaps:  If something is ______, it's a decoration. The red feather in your cap is most definitely ______; it serves no purpose other than providing a splash of color.	medium	ornamental	2	['indifference', 'alternative', 'ornamental', 'sustain']
Fill the gaps:  To ______ means to give off or let out, and it usually has a lot to do with gases, smells and noises. All of which could be potentially embarrassing, depending on where they're coming from.	medium	emit	2	['stable', 'convoluted', 'emit', 'community']
Fill the gaps:  Eagle Scout is a ______ position within the Boy Scouts.  It requires a lot of hard work over a number of years, and if you become one, lots of people will respect you.	medium	prestigious	0	['prestigious', 'emit', 'labor', 'compel']
Fill the gaps:  If you ______ something, you admit that it is true, proper, or certain — usually in an unwilling way and often in the context of a competition, as in "At midnight, the candidate finally ______d defeat."	medium	concede	1	['role', 'concede', 'conducive', 'controversy']
Fill the gaps:  If something is a ______, it is a potential source of danger. Balloons are fun, but they're a ______ for little kids who might put them in their mouths.	medium	hazard	3	['impending', 'equivalent', 'era', 'hazard']
Fill the gaps:  ______ is generally used to mean increasing forward motion. A boulder rolling down a hill gains ______. So does a great idea, a team on a winning streak, or the economy.	medium	momentum	0	['momentum', 'annual', 'expose', 'status']
Fill the gaps:  ______ means to discourage, or literally “to frighten away.” Halloween decorations that are too scary might ______ trick-or-treaters, and the risk of being expelled ______s kids from cheating in school.	medium	deter	3	['devoid', 'layer', 'abundant', 'deter']
Fill the gaps:  To ______ is to nurture something. A teacher could ______ creativity by providing crayons to every student. You can also ______ a child, which means the child lives in your home for a time.	medium	foster	0	['foster', 'benefit', 'obscure', 'concede']
Fill the gaps:  Use the verb ______ when you talk about someone who has triumphed over adversity. It's great to see a friend who's always struggled in school ______ his learning disabilities and make the honor roll.	medium	overcome	3	['decline', 'prior', 'conducive', 'overcome']
Fill the gaps:  A ______ is a limit or restriction. Hopefully your school won't cut the sports or music programs due to budget ______s!	medium	constraint	3	['distinct', 'reside', 'compel', 'constraint']
Fill the gaps:  Before you have surgery, you'd better give your ______, because the surgeon can't get his scalpel anywhere near your skin without first getting this permission from you.	medium	consent	2	['compel', 'complement', 'consent', 'estimate']
Fill the gaps:  ______ means to force or drive someone to do something. Even if you don't like toast, when you visit the toast-eating natives of Shrintakook Island, you'll be ______led to eat it, or they will not trust you.	medium	compel	3	['warp', 'extract', 'attribute', 'compel']
Fill the gaps:  A ______ is a sudden drop in status or strength. You might be winning at Monopoly until your opponents decide to team up against you, which leads to your ______.	medium	downfall	3	['contribute', 'extinct', 'distribute', 'downfall']
Fill the gaps:  Reach for the verb ______ to make different things come together or resolve a matter.	medium	reconcile	1	['warp', 'reconcile', 'reside', 'proceed']
Fill the gaps:  To ______ is to give satisfaction. So if you've managed to get straight A's in school, what you did was ______ your parents — and it probably felt pretty good to you too.	medium	gratify	1	['authority', 'gratify', 'aware', 'invest']
Fill the gaps:  ______ describes a system that organizes or ranks things, often according to power or importance. At school the principal is at the top of the staff ______, while the seniors rule the student ______.	medium	hierarchy	0	['hierarchy', 'slender', 'complementary', 'linger']
Fill the gaps:  Something ______ is logical and clear. "I told you if you didn't do your homework you couldn't watch TV. You didn't do your homework so you can't watch TV." This is a ______ argument (and annoying as well).	medium	coherent	1	['endeavor', 'coherent', 'consent', 'conform']
Fill the gaps:  Anything happening ______ is happening without difficulty. A great party has cupcakes that are ______ available. A great host will ______ admit when it’s time to put more on the table.	medium	readily	0	['readily', 'complementary', 'resent', 'migrate']
Fill the gaps:  When you ______ a task or challenge, you attempt to accomplish it. If you want to ______ a verbal challenge right now, try saying “sushi chef” ten times quickly without messing up.	medium	undertake	2	['persistent', 'interpret', 'undertake', 'community']
Fill the gaps:  Look to the adjective ______ when you need to describe something that's open to more than one interpretation, like the headline "Squad helps dog bite victim."	medium	ambiguous	1	['notion', 'ambiguous', 'hazard', 'hierarchy']
Fill the gaps:  To ______ means to force or inflict something on someone else. If you want to ______ your musical taste on your parents, play your tunes all day at top volume.	medium	impose	2	['devoid', 'impartial', 'impose', 'interpret']
Fill the gaps:  When you ______ to do something, you try hard to make it happen. A determined student might ______ to get straight As on her report card.	medium	endeavor	2	['authority', 'warp', 'endeavor', 'crude']
Fill the gaps:  A ______ is a disadvantage or slight problem. Some ______s to adopting a puppy can include lost sleep, having your sneakers gnawed on, and spending too much money at the vet.	medium	drawback	0	['drawback', 'hierarchy', 'estimate', 'specimen']
Fill the gaps:  ______ means speaking or acting for someone. A parent can sign forms on ______ of children when they are young, but adult children can sign on ______ of their aging parents.	medium	behalf	0	['behalf', 'persistent', 'stable', 'regulate']
Fill the gaps:  Use the adjective ______ to describe something that never ends or changes. If you're a ______ procrastinator, your dilly-dallying ways are never going to improve.	medium	perpetual	2	['sketch', 'enable', 'perpetual', 'extract']
Fill the gaps:  To ______ means to move from one place to another, sometimes part of a back-and-forth pattern, and sometimes to stay.	medium	migrate	1	['contribute', 'migrate', 'concede', 'readily']
Fill the gaps:  When someone ______s, he or she takes an unexpectedly long time to depart, as Romeo ______s when bidding Juliet farewell (or as annoying houseguests almost always tend to do).	medium	linger	0	['linger', 'considerable', 'hazard', 'enable']
Fill the gaps:  Something ______ is slight, or skinny. A young colt is ______ compared to the full grown horse it will grow into.	medium	slender	0	['slender', 'rigid', 'enable', 'abundant']
Fill the gaps:  Something that is ______ is very important or necessary. If you are an ______ part of the team, it means that the team cannot function without you.	medium	integral	0	['integral', 'reside', 'internal', 'era']
Fill the gaps:  When you ______ something, you remove it from a larger whole. You can ______ a passage from a book, or a liquid essence from a vanilla bean—vanilla ______.	medium	extract	1	['endeavor', 'extract', 'regulate', 'network']
Fill the gaps:  When you wander without a plan or a specific destination, you ______. Your cat may stay close to your house when you let her outside, or she may ______ around the neighborhood all day.	medium	roam	1	['internal', 'roam', 'impartial', 'benefit']
Fill the gaps:  A ______ is a rough or brief outline of something. If you hand in a ______, instead of your full paper, don't expect to get a very high grade!	medium	sketch	0	['sketch', 'conducive', 'defective', 'hierarchy']
