question	category	word	correct_option	options
Fill the gaps:  ______ means to need. You ______ food, water, and shelter to live, but do you really ______ that new pair of high-fashion shoes?	easy	require	0	['require', 'participate', 'access', 'remove']
Fill the gaps:  To ______ is to make something more clear or visible. Children's books are ______d with pictures. An example can ______ an abstract idea.	easy	illustrate	3	['analyze', 'demonstrate', 'mental', 'illustrate']
Fill the gaps:  There's a certain way of doing things. A systematic, logical process for accomplishing a task. And it's called a ______.	easy	method	3	['adjust', 'concept', 'establish', 'method']
Fill the gaps:  To ______ is to look into something systematically. If you don't understand how tornadoes work, for example, ______ the forces of wind and find out.	easy	investigate	3	['achieve', 'specify', 'evaluate', 'investigate']
Fill the gaps:  When asked what the ______, or essential, principles of life are, a teenager might reply, "Breathe. Be a good friend. Eat chocolate."	easy	fundamental	3	['context', 'accurate', 'substitute', 'fundamental']
Fill the gaps:  If you have a ______ amount of something, it's enough — not too much, not too little, just right.	easy	sufficient	0	['sufficient', 'section', 'obvious', 'relevant']
Fill the gaps:  "The Freshman 15" describes freshman-year college students who gain about fifteen pounds because they ______ way too much lousy dorm food all day long.	easy	consume	3	['maximize', 'furthermore', 'assist', 'consume']
Fill the gaps:  The verb ______ means to show a difference, like photos that reveal how much weight someone lost by doing a ______ between the "before" and "after" shots.	easy	contrast	1	['physical', 'contrast', 'context', 'rely']
Fill the gaps:  ______ is information such as facts and numbers used to analyze something or make decisions. Computer ______ is information in a form that can be processed by a computer.	easy	data	1	['resource', 'data', 'major', 'investigate']
Fill the gaps:  ______ means the setting of a word or event. If your friend is furious at you for calling her your worst enemy, remind her that the ______ of those remarks was Opposite Day.	easy	context	1	['investigate', 'context', 'major', 'respond']
Fill the gaps:  ______ has several meanings, but one of the most common is to write down or record officially. Like to  ______ for classes at the beginning of a semester.	easy	register	0	['register', 'circumstance', 'data', 'whereas']
Fill the gaps:  ______ means "for this reason," or "therefore." One Hollywood starlet is a huge fan of tiny dogs, ______ the Pomeranian puppy peeking out of her purse.	easy	hence	0	['hence', 'analyze', 'feature', 'major']
Fill the gaps:  A ______ is a thought or idea. If you're redecorating your bedroom, you might want to start with a ______, such as "flower garden," or, if that's too femme, "black hole in outer space."	easy	concept	1	['minor', 'concept', 'specify', 'lecture']
Fill the gaps:  Something or someone that takes the place of another is said to be a ______. You may be sent into a game as a ______ for an injured player, or you might ______ chocolate chips for blueberries in a pancake recipe.	easy	substitute	1	['mental', 'substitute', 'adjust', 'indicate']
Fill the gaps:  To ______ is to get near something. An airplane is cleared for a final ______ just as the wheels ______ the landing strip.	easy	approach	1	['assume', 'approach', 'major', 'consume']
Fill the gaps:  To ______ is to make something important, or stress it, like when you were little and your parents would always ______ the importance of looking both ways before crossing the street. They told you again and again and again. And again.	easy	emphasize	2	['illustrate', 'specify', 'emphasize', 'primary']
Fill the gaps:  To ______ means to point something out or to present evidence. If you feel sick during a car trip, you can ______ this to the driver by groaning loudly or announcing "I'm going to be sick!"	easy	indicate	0	['indicate', 'assume', 'major', 'function']
Fill the gaps:  When you have a ______, you have a set of beliefs or principles that might not be proven yet. Does anyone have a good ______ for where missing socks go when you do laundry?	easy	theory	0	['theory', 'label', 'circumstance', 'nevertheless']
Fill the gaps:  Something ______ is short and to the point. If you make a ______ visit, you don't stay long. If you make a ______ statement, you use few words. If you wear ______ shorts, you are showing a little too much leg.	easy	brief	2	['fundamental', 'theory', 'brief', 'section']
Fill the gaps: A ____ is what's popular at a certain point in time. While a ____ usually refers to a certain style in fashion or entertainment, there could be a ____ toward warmer temperatures (if people are following ____ associated with global warming).	easy	trend	1	['consequence', 'trend', 'evident', 'label']
Fill the gaps:  An _____ is a specific example or case of something. One _____ of being chased by a growling dog can make a person spend his whole life being afraid of animals.	easy	instances	3	['nevertheless', 'approach', 'indicate', 'instances']
Fill the gaps:  ______ is used as a preposition when something happens even though it might have been prevented by something else. You might go see a movie ______ hearing a review calling it worse than "Showgirls" and "Ishtar" combined.	easy	despite	0	['despite', 'primary', 'emphasize', 'modify']
Fill the gaps:  In science, a ______ is an idea or explanation that you then test through study and experimentation. Outside science, a theory or guess can also be called a ______.	easy	hypothesis	1	['participate', 'hypothesis', 'lecture', 'involve']
Fill the gaps:  When your teacher stands up in front of you and teaches by talking about the latest chapter you've read or explaining how to do a new math problem - he is giving a ______.	easy	lecture	1	['assess', 'lecture', 'approach', 'restrict']
Fill the gaps:  Before you try to sell your car, you should ask an expert to ______ its value––once you know what it's worth, it's easier to find a fair price. When you ______ a matter, you make a judgment about it.	easy	assess	3	['transfer', 'context', 'comment', 'assess']
Fill the gaps:  The word ______ is about pressure, whether it's pressure on a syllable of a word, an object (the bridge is designed to handle the ______ of the cars), or a person (I am under a lot of ______).	easy	stress	0	['stress', 'modify', 'period', 'involve']
Fill the gaps:  To ______ is to limit. If you want to eat more healthily, you might ______, or limit, yourself to eating only foods containing fruits and vegetables –- like carrot cake and apple pie.	easy	restrict	3	['despite', 'specify', 'consume', 'restrict']
Fill the gaps:  You might ______ a Ming dynasty vase, a suspect in a bank robbery, or an ivory-billed woodpecker. Whatever it is, when you recognize the identity of someone or something, you ______ it.	easy	identify	3	['restrict', 'fundamental', 'assume', 'identify']
Fill the gaps:  When you ______ something, you show what it is or how it works. To ______ how your new juicer works, you should have lots of kale, carrots, and beets on hand — and some brave friends to try your concoction.	easy	demonstrate	0	['demonstrate', 'adequate', 'significant', 'specify']
Fill the gaps:  ______ isn't only used to mean "accept as truth without checking"; it also means "take on the form of." It might be safer if you don't ______ that the vampire standing in front of you isn't merely a person assuming that form.	easy	assume	3	['select', 'rely', 'expand', 'assume']
Fill the gaps:  ______ means to study or examine something carefully in a methodical way. If you ______ your child's report card, you may determine his strength and weaknesses (and how many times he cut class).	easy	analyze	3	['maximize', 'constant', 'respond', 'analyze']
Fill the gaps:  Something that is ______ is exact and true. It's important to be ______ in the kitchen with your measurements and in the courtroom with your testimony.	easy	accurate	0	['accurate', 'indicate', 'method', 'approach']
Fill the gaps:  Think of something or someone that does not change as ______.  A classmate's ______ drumming on the table with his fingers could be a ______ source of annoyance.	easy	constant	2	['consume', 'participate', 'constant', 'section']
Fill the gaps:  One copy of "Celebrities are Cool" magazine is an ______. It is ______d, or put out, by the publisher. You and your mother may argue over the ______, or topic, of whether or not you should read it.	easy	issue	0	['issue', 'sufficient', 'respond', 'circumstance']
Fill the gaps:  To ______ means to point something out or to present evidence. If you feel sick during a car trip, you can ______ this to the driver by groaning loudly or announcing "I'm going to be sick!"	easy	indicate	0	['indicate', 'sufficient', 'fundamental', 'brief']
Fill the gaps:  To ______ is to change or transform, but only slightly. If you miss your free-throws half the time, your coach will try to  ______ your technique in order improve your shooting average.	easy	modify	3	['project', 'evident', 'nevertheless', 'modify']
Fill the gaps:  A funny-looking adverb that appears to be made up of three words squished together, ______ means “even so" or "all the same.”	easy	nevertheless	2	['significant', 'circumstance', 'nevertheless', 'adjust']
Fill the gaps:  The ______ meaning of the word ______ is that it covers all the parts of something. For example, the individual parts don't matter as much as the ______ value.	easy	overall	3	['emphasize', 'culture', 'focus', 'overall']
Fill the gaps:  To ______ is to say what you think is going to happen in the future.  If you ______ that you'll win the poker championship, you're either really confident in your poker skills or you're cheating.	easy	predict	1	['resource', 'predict', 'maintain', 'previous']
Fill the gaps:  Use the adjective ______ to describe something that is important. Your "______ other" means the person who's most important in your life. A ______ result in a scientific study is a result large enough to matter.	easy	significant	2	['resource', 'predict', 'significant', 'available']
Fill the gaps:  The famous design dictum "form follows ______" tells us that an object's design should reflect what it does.	easy	function	3	['contrast', 'identify', 'adequate', 'function']
Fill the gaps:  Just when you think your friend has finished her long list of complaints, she begins a new sentence with, “______…” a word that signals she has even more to complain about.	easy	furthermore	1	['feature', 'furthermore', 'hypothesis', 'conduct']
Fill the gaps:  A ______ is a piece of work that is planned or intended. Plan a little extra time for your gingerbread house ______ — gluing the walls and roof can take a while.	easy	project	2	['method', 'substitute', 'project', 'theory']
Fill the gaps:  When you want to say that something is enough or good enough for a particular need, use the adjective ______. You might have an ______ amount of flour for a batch of pancakes, but not a lot extra.	easy	adequate	0	['adequate', 'transfer', 'assume', 'identify']
Fill the gaps:  A ______ is a part of something that makes it special or able to work better, such as a bonus ______ on a DVD or a smartphone ______ that provides faster Internet connections.	easy	feature	1	['contact', 'feature', 'participate', 'individual']
Fill the gaps:  To ______ something means to choose it from among others. If you ______ the most expensive phone, it doesn’t necessarily mean you will be happy with what you get.	easy	select	2	['feature', 'source', 'select', 'challenge']
Fill the gaps:  To ______ something means to begin it or bring it about. If you want everyone in your family to bring you chocolate every evening, you can ______ a “Chocolates for Me” policy requiring it.	easy	establish	1	['focus', 'establish', 'evident', 'occupy']
Fill the gaps:  When you ______ to something, you change so that you can fit in, or conform. Arriving at a new school almost always requires that you ______ a little. Once you ______, you'll find you're as happy as you were in your old school.	easy	adjust	2	['concept', 'approach', 'adjust', 'resource']
Fill the gaps:  To ______ means to connect. When you get ______d in the Spanish Club, you attend meetings and events. If doing math well is ______d in understanding advanced chemistry, that means it's a necessary part of it.	easy	involve	2	['significant', 'consequence', 'involve', 'investigate']
Fill the gaps:  ______ is the act of touching or communicating with someone or something else. The question increasingly isn't whether there is other life in the universe, but how on earth we will ever make ______ with it.	easy	contact	3	['sufficient', 'whereas', 'occupy', 'contact']
Fill the gaps:  Invited to a great party? You might ______ by shouting "Hooray!" and then letting your friend know you'll be there. To ______ is to react or reply.	easy	respond	3	['expand', 'data', 'challenge', 'respond']
Fill the gaps:  ______ is most often used as a verb meaning “to have an impact on,” as in “The tornado barreling towards us will ______ our picnic plans.”	easy	affect	2	['brief', 'react', 'affect', 'assess']
Fill the gaps:  The verb ______ means to make something bigger or wider. It might refer to something concrete, as when you blow into a balloon and make it ______, or something more abstract, as when you study to ______ your mind.	easy	expand	0	['expand', 'mental', 'consume', 'focus']
Fill the gaps:  To explicitly name something or state a particular detail, you ______ that thing. So, when you have a craving for dessert and you send someone to the store to buy ice cream, you may want to ______ a flavor.	easy	specify	0	['specify', 'indicate', 'strategy', 'assess']
Fill the gaps:  When you ______ something, you rule it out or dismiss it. If you're trying to pick a fancy restaurant to go to for your birthday, you'll probably ______ the diner you went to just yesterday.	easy	reject	1	['illustrate', 'reject', 'adjust', 'participate']
Fill the gaps:  ______ means to express, suggest, or show something without stating it directly: A friend’s gruff manner would ______ that she’s in a foul mood.	easy	imply	0	['imply', 'fundamental', 'evident', 'concept']
Fill the gaps:  The noun ______ describes an origin, like the ______ who gave the journalist the information that broke a new story, or the place something originates, like the ______ of a river, or the Web site that is your ______ for celebrity gossip.	easy	source	3	['remove', 'register', 'comment', 'source']
Fill the gaps:  In the game of capture-the-flag, running toward your flag screaming is not a good ______. A ______ is any plan you make to achieve a goal.	easy	strategy	1	['furthermore', 'strategy', 'conduct', 'trend']
Fill the gaps:  ______ means the one that just came before. For instance, the ______ sentence explained the meaning of the word ______.	easy	previous	2	['despite', 'accurate', 'previous', 'restrict']
Fill the gaps:  Most libraries provide computers you can use to ______ the Internet. If chemicals are being stolen from a lab, you might ask who has ______ to the lab. ______ is approaching or making use of something, or the ability to do so	easy	access	1	['nevertheless', 'access', 'research', 'respond']
Fill the gaps:  A ______ is a part or piece of something that fits together with the other pieces to make a whole. Like the arts ______ of a newspaper, or the rhythm ______ of the band that gets reviewed in it.	easy	section	1	['analyze', 'section', 'resource', 'furthermore']
Fill the gaps:  A ______ is all about defining when something begins and ends. Class ______s usually last about forty-five minutes. Following the last food fight, there was a ______ of relative peace in the school.	easy	period	1	['imply', 'period', 'react', 'assume']
Fill the gaps:  Use the verb ______ when an event or a thought happens, like when it ______s to you that you've left home without your umbrella. Maybe you didn't hear the forecast that showers would ______ this afternoon.	easy	occur	0	['occur', 'culture', 'previous', 'participate']
Fill the gaps:  The saying “______s are for jars not people” means it’s OK to put a description on a jar so you know what’s inside, but it’s not okay to judge people by attaching a ______, or description to them, such as "nerd," "jock," or "burnout."	easy	label	2	['modify', 'restrict', 'label', 'trend']
Fill the gaps:  When you spend a lot of your free time reading tea leaves, you ______ yourself with that pastime, meaning it takes up your time and keeps you busy.	easy	occupy	3	['demonstrate', 'data', 'adequate', 'occupy']
Fill the gaps:  If you take part in an activity or organization, you ______ in it. For example, you ______ in a conversation by listening to and talking with others, or you ______ in a sport by joining a team and taking part in practices and games.	easy	participate	2	['major', 'assist', 'participate', 'resolve']
Fill the gaps:  A ______ is an area. A ______ can be geographic — like a part of a country. A ______ can be intellectual — like a ______ of the mind. There are also bodily ______s — like abdominal, thoracic, and posterior.	easy	region	1	['reject', 'region', 'data', 'contrast']
Fill the gaps:  To ______ is to settle or make a decision about something — often formal. A college's board of directors  might ______ to recruit more minority students. As a noun, ______ refers to a strong determination to do something.	easy	resolve	2	['access', 'whereas', 'resolve', 'issue']
Fill the gaps:  You can ______ your name from a list, ______ a stain from a t-shirt, or ______ old furniture from your house. Whatever it is, when you ______ something, you take it somewhere else or get rid of it completely.	easy	remove	2	['illustrate', 'maximize', 'remove', 'transfer']
Fill the gaps:  To ______ is to have confidence in something. You might ______ on staying in bed to make you feel better and ______ on your friends to tell you everything you missed when you were sick.	easy	rely	0	['rely', 'method', 'conduct', 'establish']
Fill the gaps:  When something is ______ it's really there. You can see it, touch it, taste it, hear it, or smell it. The ______ world is all of the stuff around you.	easy	physical	2	['analyze', 'function', 'physical', 'indicate']
Fill the gaps:  A ______ is any personal talent or outside supply that can be tapped for help or support.	easy	resource	2	['data', 'method', 'resource', 'focus']
Fill the gaps:  To ______ things is to build them. You might ______ a sand castle the next time you're at the beach, or you might ______ a theory about why your brother always manages to get away with breaking the rules.	easy	construct	2	['rely', 'focus', 'construct', 'project']
Fill the gaps:  To ______ is to state your opinion on something. Of course, it's good to know when to hold your tongue. ______ on the latest movie? No problem. ______ on the annoying airport security measures while having your baggage checked? Better not.	easy	comment	1	['accurate', 'comment', 'minor', 'strategy']
Fill the gaps:  Something is ______ if it's appropriate or connected to the matter at hand. ______ things are helpful and on point.	easy	relevant	1	['respond', 'relevant', 'require', 'label']
Fill the gaps:  If you are moving something from one place to another, like paying money from your bank account for your rent, you are doing a ______. Or, if you have to move from one job site to another — that is a ______.	easy	transfer	1	['relevant', 'transfer', 'brief', 'theory']
Fill the gaps:  A ______ is a specific group of people during a particular time — like the hippie ______ of the 1960's. ______ can also imply exposure to the arts. Visit a museum if you are in need of a dose of ______.	easy	culture	1	['maximize', 'culture', 'period', 'trend']
Fill the gaps:  Something ______ is big, big, big! It's ______, baby! It's large! Important! Intense! Powerful! Michael Jackson's album "Thriller" was ______, eventually becoming the biggest-selling album of all time.	easy	major	0	['major', 'whereas', 'research', 'occupy']
Fill the gaps:  Something that's ______ is considered of low importance — a ______ injury is not very serious, and a college student's ______ subject is a secondary field of study.	easy	minor	2	['physical', 'region', 'minor', 'brief']
Fill the gaps:  The word ______ is all about being a single entity that cannot be divided. It can mean person or even personal. A team is made up of ______s, and each ______ has ______ strengths and weaknesses.	easy	individual	1	['section', 'individual', 'maintain', 'nevertheless']
Fill the gaps:  ______ means to keep the same––keep steady, keep up, or keep going. Sure, you can ride your bike super fast on a flat surface, but it can be hard to ______ that speed, or keep the same speed, going up a hill.	easy	maintain	1	['hence', 'maintain', 'affect', 'reject']
Fill the gaps:  When you ______ something, you make it as big as you possibly can, the way you would ______ your chances of winning the lottery if you spent all of your money on lottery tickets.	easy	maximize	3	['region', 'project', 'specify', 'maximize']
Fill the gaps:  In their spare time, teenagers LOVE doing extra ______, by investigating the facts of a certain subject and studying and recording what they learn. And if you believe that, you need to do more ______ on the habits of teenagers.	easy	research	1	['indicate', 'research', 'issue', 'sufficient']
Fill the gaps:  When you ______ something, you're making a judgment, one that most likely results from some degree of analysis.	easy	evaluate	2	['consequence', 'feature', 'evaluate', 'major']
Fill the gaps:  ______ means "first." When you vote in a ______, that is the first election in a series. When a matter is of ______ concern, it means it's of first importance. ______ school is the first you go to (after nursery school, at least).	easy	primary	1	['assess', 'primary', 'hence', 'resolve']
Fill the gaps:  A ______ is the condition in which something happens. Say you were at a business luncheon and you were accidentally fed psychedelic mushrooms in your ravioli, your boss might excuse the weird things you said, given the ______.	easy	circumstance	1	['accurate', 'circumstance', 'rely', 'occur']
Fill the gaps:  If you ______ something, you've reached a goal. ______ments aren't accidents. If you stumble upon a treasure chest, you haven't ______d something; however, achieving a promotion to become CEO is another story.	easy	achieve	0	['achieve', 'label', 'predict', 'minor']
Fill the gaps:  A ______ is something that puts you to the test — like running your first marathon or reading War and Peace.	easy	challenge	3	['resource', 'assess', 'lecture', 'challenge']
Fill the gaps:  Things in a sequence come one after another, as in a number sequence of 1, 2, 3, 4. A ______ comes after, or as a result of something you do, for example, "He was given a traffic ticket as a ______ of running the red light."	easy	consequence	3	['assess', 'physical', 'significant', 'consequence']
Fill the gaps:  The adjective ______ describes anything having to do with the mind, just as "physical" has to do with the body. ______ has to do with the intellect, the mind, or the brain.	easy	mental	2	['contact', 'research', 'mental', 'section']
Fill the gaps:  Something ______ is plain to see and easily understandable. It was ______ that you didn't enjoy your meal because I found it rolled in a napkin and shoved under the rug.	easy	obvious	0	['obvious', 'complex', 'predict', 'accurate']
Fill the gaps:  "Is this seat  ______?" "Are you  ______, or are you married?" As you can tell from these two examples, ______ means "not busy or not taken."	easy	available	3	['establish', 'circumstance', 'modify', 'available']
Fill the gaps:  To ______ means to get or come to own something. You ______ an education by your own effort. You ______ a painting by paying for it, or when someone gives it you. You ______ a sense of calm in crisis through experience.	easy	acquire	3	['illustrate', 'transfer', 'adequate', 'acquire']
Fill the gaps:  People who are really good at math can handle ______ math problems. The rest of us are all set with simple stuff like the times tables. Use ______ to refer to something that is not simple.	easy	complex	1	['data', 'complex', 'primary', 'rely']
Fill the gaps:  When you ______ to something, you respond to it. If someone pokes you in class, you might ______ by sticking out your tongue at them. The teacher might then ______ by giving you both detention.	easy	react	3	['concept', 'affect', 'challenge', 'react']
Fill the gaps:  If something is ______, it's visible. If you blush furiously and start shaking every time your crush comes near, your infatuation will be ______ to everyone.	easy	evident	3	['source', 'challenge', 'assist', 'evident']
Fill the gaps:  You run up the field, pass the ball to the forward and she scores!  It’s your third ______ of the game. On and off the soccer field, to ______ is to help or contribute.	easy	assist	0	['assist', 'obvious', 'source', 'despite']
Fill the gaps:  ______ is something that camera lenses and sleepy students are always being asked to do. For cameras, it means finding a point where the subject is clear or "in ______." For students, it means paying attention.	easy	focus	0	['focus', 'maximize', 'minor', 'mental']
Fill the gaps:  ______ means to get something that is not so easy to come by such as knowledge, rights, or a large amount of money. You wouldn't say you ______ed a pair of pants, unless they were one of a kind.	medium	obtain	1	['persevere', 'obtain', 'coherent', 'crude']
