question	category	word	correct_option	options
Fill the gaps:  Something that deviates from the norm is ______. Something ______ can be good, such as an exciting new direction in music or art. But that ______ly low score on your math test? Not so good.	hard	anomalous	2	['orient', 'elicit', 'anomalous', 'justify']
Fill the gaps:  When you ______ something, you close or attach it. You might ______ your coat, closing each snap, when the sun goes down and the air gets chilly.	hard	fasten	1	['shred', 'fasten', 'preposterous', 'fracture']
Fill the gaps:  If you drive into someone's fence, you’ll probably be held ______ — legally responsible — for fixing it. ______ can also mean “likely,” usually with something unpleasant: "If you don't brush your teeth, they're ______ to fall out."	hard	liable	3	['refute', 'fluctuate', 'exhaustive', 'liable']
Fill the gaps:  If something happens after something else, it will ______, meaning it will follow after or be the result. When a sneeze comes out, and he hears the "Achoo!," a "Bless you" or "Gesundheit" soon will ______.	hard	ensue	2	['derivative', 'carve', 'ensue', 'outgoing']
Fill the gaps:  If your curtains allow light to pass through, they're ______, or see-through. ______ can also describe something steep, like a cliff, or anything extreme, like ______ nerve.	hard	sheer	3	['rural', 'coordinate', 'compulsory', 'sheer']
Fill the gaps:  Something is ______ when it has an uneven edge or quality to it. Teeth can be ______, saw blades can be ______, and the edges of leaves can be ______.	hard	jagged	2	['congregate', 'proportion', 'jagged', 'relic']
Fill the gaps:  The verb ______ is to prove that something is wrong. When the kids you're babysitting swear they brushed their teeth, you can ______ their claim by presenting the dry toothbrushes.	hard	refute	2	['meticulous', 'propagate', 'refute', 'serene']
Fill the gaps:  _____ means "evade or escape," like the way you might _____ the other kids during a game of hide-and-seek. This word can also mean "to be hard to understand." No matter how hard you try, the finer points of quantum physics might _____ you.	hard	elude	0	['elude', 'emerge', 'futile', 'faint']
Fill the gaps:  Something ______ is common in a particular place at a particular time. ______ things are hard to avoid. When you see the word ______, think "It's everywhere!"	hard	prevalent	3	['subsume', 'diffuse', 'shred', 'prevalent']
Fill the gaps:  When something ______s, it's growing, spreading or multiplying really quickly. Bunny rabbits have a habit of proliferating, as do dandelions in untended gardens and funny YouTube videos on the internet.	hard	proliferate	2	['blunt', 'subsume', 'proliferate', 'coordinate']
Fill the gaps:  If you’re talking about the most popular or common thing, call it ______. If the ______ feeling in a neighborhood is that pizza is the best food, the result might be pizzerias being the ______ type of restaurant there.	hard	predominant	0	['predominant', 'relic', 'delusion', 'valid']
Fill the gaps:  Keep your eye on the adjective ______ for something that stands out so much you notice it right away — like that zit in the center of your friend's forehead.	hard	conspicuous	0	['conspicuous', 'subsume', 'diverse', 'dormant']
Fill the gaps:  Something that is ______ has a nice smell. What makes a smell nice is subjective, or course. You might find a bowl of dried lavender to be ______, but your dog might prefer a pile of horse poop.	hard	fragrant	0	['fragrant', 'pursue', 'prevail', 'negate']
Fill the gaps:  If a characteristic or ability is already present in a person or animal when they are born, it is ______. People have the ______ ability to speak whereas animals do not.	hard	innate	3	['subsume', 'exclude', 'ensue', 'innate']
Fill the gaps:  Something that slopes — that is, something that deviates from the straight horizontal or vertical — can be called an ______. If you like to walk up and down hills, you enjoy walking on ______s.	hard	incline	2	['plead', 'apparent', 'incline', 'exhaustive']
Fill the gaps:  You can use the verb ______ as a way to say "stop" or "cease." Instead of yelling "Cut it out!" the new neighbor asked the tween girls to ______ from playing any more loud, screeching music from that long-haired boy-band.	hard	desist	2	['intervene', 'consist', 'desist', 'underlying']
Fill the gaps:  Use the noun ______ when someone isn't interested in the important things that are happening. You might feel ______ for the political process after watching candidates bicker tediously with one another.	hard	apathy	2	['oversee', 'monitor', 'apathy', 'fasten']
Fill the gaps:  From the Latin "intervenire," meaning “to come between,” the verb ______ means just that: to get involved, to jump in the middle of something, to interfere.	hard	intervene	3	['turbulent', 'secrete', 'cherish', 'intervene']
Fill the gaps:  Use the word ______ to describe an event that causes great harm and misery, or a general state of distress or misery: the ______ of war.	hard	calamity	2	['external', 'ensue', 'calamity', 'comprise']
Fill the gaps:  A ______ place is isolated, away from other people. It's quiet, and there's not a lot going on.	hard	secluded	0	['secluded', 'dormant', 'counterpart', 'liable']
Fill the gaps:  When something ______s other things, it is made up of them or formed from them. The periodic table ______s 118 elements, because the whole ______s the parts.	hard	comprise	1	['intervene', 'comprise', 'discrete', 'fragrant']
Fill the gaps:  When you ______ something, you escape it. You could ______ a police chase by slipping into a secret alley, or you could ______ your mother's questions about the missing cookies by slipping into another topic.	hard	evade	2	['illusory', 'emerge', 'evade', 'desist']
Fill the gaps:  If you take a rectangle or a circle and stretch it out, you end up with an elongated shape called an ______.  If you stretch a circle until it becomes an oval, you've made it ______.	hard	oblong	1	['scheme', 'oblong', 'framework', 'remnant']
Fill the gaps:  When something is ______ it's depressing or lifeless in a rainy-day way. I finished my work, there was nothing on TV, and the rain just wouldn't stop: what a ______ day!	hard	dreary	0	['dreary', 'oblong', 'subsequent', 'aspect']
Fill the gaps:  ______ is all about respect and admiration. If you have high self-______, it means you like yourself. When you say, "My ______ed colleagues," you are saying you have nothing but the highest respect for them.	hard	esteem	2	['plausible', 'astute', 'esteem', 'seek']
Fill the gaps:  In prison movies, there's always a character who is able to ______ all sorts of contraband from the inside––magazines, cigarettes, special soap. If you ______ something, you get it or bring it about by special effort.	hard	procure	2	['tenacious', 'novel', 'procure', 'valid']
Fill the gaps:  If something looks or sounds ______, be careful: a threat or an unpleasant event is at hand. If you see an ______ frown on your boss's face, you're in trouble!	hard	ominous	2	['rural', 'eradicate', 'ominous', 'scheme']
Fill the gaps:  Something ______ is very obvious and offensive. Don't get caught in a ______ lie, because you won't be able to weasel your way out of it.	hard	blatant	2	['counterpart', 'ominous', 'blatant', 'proportion']
Fill the gaps:  To ______ literally means to dig a hole underneath something, making it likely to collapse. But we more often use the word to describe sabotage or the act of weakening someone else's efforts.	hard	undermine	2	['rugged', 'oversee', 'undermine', 'mundane']
Fill the gaps:  If something is ______, it delivers a feeling or experience from someone else. If your child becomes a big star, you might have a ______ experience of celebrity.	hard	vicarious	3	['deviate', 'blatant', 'valid', 'vicarious']
Fill the gaps:  ______ means close to or near something. You may consider the people up and down your street to be neighbors, but your next-door neighbor is the person who lives in the house or apartment ______ to yours.	hard	adjacent	1	['exhaustive', 'adjacent', 'waive', 'monitor']
Fill the gaps:  ______ has two meanings that seem quite different: "an amount" or "to give way." The ______ of the recipe was twelve brownies. To avoid being tripped, Mary was forced to ______ to the children on her way to the brownie plate.	hard	yield	2	['strive', 'cherish', 'yield', 'successor']
Fill the gaps:  ______ means to absorb or include. A successful company might ______ a failing competitor through a merger, or love may ______ you in the early stages of a romance.	hard	subsume	2	['confer', 'facilitate', 'subsume', 'aspect']
Fill the gaps:  If you ______ from something, you restrain yourself from consuming it. People usually ______ from things that are considered vices — like eating French fries every day for lunch.	hard	abstain	3	['integrate', 'comprise', 'oblong', 'abstain']
Fill the gaps:  The ______ qualities of something have to do with its nature. An ______ quality of dogs is that they're loyal.	hard	intrinsic	2	['proliferate', 'grave', 'intrinsic', 'detrimental']
Fill the gaps:  If you bolt, scram, skedaddle, or get the heck of out Dodge, you ______. You run away fast. Don’t confuse ______ with "flea." They sound alike, but the second kind is an insect whose bites make you itch.	hard	flee	3	['brisk', 'policy', 'relic', 'flee']
Fill the gaps:  If something is ______, it cannot surprise or injure you. It’s predictable. ______ can be used as an adjective or verb. A circus lion is ______ (adjective) because it’s been ______d (verb). A “lion-______r” beat the wildness out of it.	hard	tame	3	['welfare', 'perceive', 'plead', 'tame']
Fill the gaps:  If you chat, and talk it up with someone, you have conversation, but if you're looking for input from each other as you talk, you _____, or consult, together. They had a family meeting to _____ about a schedule for sharing the new laptop.	hard	confer	0	['confer', 'yield', 'probe', 'perspective']
Fill the gaps:  To ______ is to change from one shape to another. A cute bunny, for example, might ______ into a killer dragon in a fairy tale or an animated film.	very hard	morph	3	['savage', 'seasoned', 'despondent', 'morph']
Fill the gaps:  Use ______ to refer to a very small difference in color, meaning, or feeling. What makes singers brilliant is not how loud they can sing a note, but how many ______s they can evoke through their approach.	very hard	nuance	2	['elusive', 'hoist', 'nuance', 'audacious']
Fill the gaps:  Have you ever had to prove a point? If so, you probably needed to find evidence that could not be denied — that was absolutely true. That evidence would be considered ______, impossible to disprove.	very hard	irrefutable	3	['savage', 'gaudy', 'foremost', 'irrefutable']
Fill the gaps:  When the homeowner described her ant problem as a ______, the exterminator thought she was being a bit melodramatic. After all, a few bugs aren't exactly a huge calamity.	very hard	plague	3	['inept', 'trivial', 'inexorable', 'plague']
Fill the gaps:  ______ is a word for a lot of something or even way too much — a ______ rainfall is a serious amount of rain.	very hard	profuse	3	['coax', 'adept', 'dwelling', 'profuse']
Fill the gaps:  If you are ______, you are discouraged, very sad, and without hope. If you are depressed, you might describe your mood as ______.	very hard	despondent	0	['despondent', 'indigenous', 'pressing', 'swivel']
Fill the gaps:  Have you ever seen a blacksmith make a horseshoe? Well, no, probably not, but they use a special furnace which is called a ______, and "to ______ something" is also the act of bashing that hot object into shape.	very hard	forge	0	['forge', 'wares', 'deplete', 'dwell']
Fill the gaps:  To ______ something is to get it thoroughly wet. You might ______ your sister with the garden hose to pay her back for squirting you with her water pistol.	very hard	drench	3	['involved', 'forage', 'vessel', 'drench']
Fill the gaps:  The verb ______ is a somewhat formal way of saying "to bring together for the purpose of a meeting."	very hard	convene	3	['bleak', 'verge', 'inept', 'convene']
Fill the gaps:  When you ______ something—say, the price of gas—you find a way to make up for it. My new car's ability to get fifty miles per gallon ______ the rise in the price of gas. ______ functions as both a noun and a verb.	very hard	offset	1	['accrete', 'offset', 'undergo', 'involved']
Fill the gaps:  Use the adjective ______ to mean "full of" or "widespread," especially when you're talking about something negative. If the lifeguard says the water is ______ with jellyfish, you're not going to want to swim in it.	very hard	rife	1	['morale', 'rife', 'cope', 'deplete']
Fill the gaps:  When soil or land ______s, it wears away or is removed. Many beaches seem to get smaller and smaller, as the endless wash of the waves begins to ______ the fine sand.	very hard	erode	1	['prolific', 'erode', 'convene', 'depress']
Fill the gaps:  Anything that ______s slows progress or makes it difficult to do something. You might think that the presence of your parents ______s your ability to look cool.	very hard	hamper	2	['elective', 'raze', 'hamper', 'vessel']
Fill the gaps:  Use ______ to describe a plant, animal or person that is native or original to an area. Though Switzerland is known for its chocolates, chocolate, which comes from the cocoa plant, is ______ to South America.	very hard	indigenous	1	['irrefutable', 'indigenous', 'rebound', 'apex']
Fill the gaps:  ______ people are sophisticated, polished, cultured, refined. Spend enough time in an urban setting–-going to concerts and museums, spending time in crowds––and you'll be ______ too.	very hard	urbane	3	['ornate', 'forage', 'drought', 'urbane']
Fill the gaps:  When you say someone is a ______ pacifist, you are suggesting that they are a pacifist in name only. While they are busy making everyone talk about how peaceful they are, chances are they're also bombing villages to dust.	very hard	so-called	2	['hoist', 'qualify', 'so-called', 'notwithstanding']
Fill the gaps:  Something that's ______ is optional — you can choose to do it, or not. An ______ course in school is one you take because you want to rather than to fill a particular requirement, although you still get credit for it.	very hard	elective	3	['fastidious', 'fable', 'wither', 'elective']
Fill the gaps:  ______ means open and done in plain sight. An ______ demand for an increase in your allowance probably won't work; instead, try praising your parents' generosity and dropping hints about how high prices are these days.	very hard	overt	3	['brittle', 'deplete', 'arid', 'overt']
Fill the gaps:  Things that ______ simply grow smaller. "My initial enthusiasm for helping ______d when I saw the massive pile of envelopes that needed sealing."	very hard	wane	2	['juxtapose', 'drought', 'wane', 'lull']
Fill the gaps:  Something that is ______ is not important or significant, such as the ______ details you shared with me about your trip to the post office this morning.	very hard	trivial	3	['wither', 'barter', 'baffle', 'trivial']
Fill the gaps:  If you want to describe a person who insists on perfection or pays much attention to food, clothing and cleanliness, the right word is ______.	very hard	fastidious	3	['seep', 'adhere', 'mushroom', 'fastidious']
Fill the gaps:  An ______ is the force behind something, whether it's a boulder rolling down a hill or a person making a decision.	very hard	impetus	1	['involved', 'impetus', 'excavate', 'accrete']
Fill the gaps:  Use the adjective ______ to describe something or someone very precise or strict in its requirements. If your teacher has ______ standards about spelling and punctuation, you better carefully check your final paper.	very hard	exacting	2	['exacerbate', 'spur', 'exacting', 'so-called']
Fill the gaps:  A ______ is an extra touch — a trumpet's "ta-ta-da!" announcing a king's entrance, a fancy carving atop an otherwise utilitarian pillar, a wave of a flag or a cheerleader's pompom.	very hard	flourish	3	['rebound', 'fleeting', 'plague', 'flourish']
Fill the gaps:  ______ is an adjective meaning “clear” or “noticeable.” Filling your living room with pictures of pandas will show your ______  appreciation for all things panda.	very hard	marked	1	['hamper', 'marked', 'brittle', 'torrent']
Fill the gaps:  Something ______ is easily broken. Do you have ______ bones? Then no football or rugby for you.	very hard	brittle	3	['propulsion', 'hinder', 'spearhead', 'brittle']
Fill the gaps:  A ______ is a device that allows something to turn freely. Desk chairs are often designed so the seat can ______ atop the base. In the hospital, the TV is usually mounted on a ______ so that patients can adjust it.	very hard	swivel	1	['incessant', 'swivel', 'trappings', 'ruthless']
Fill the gaps:  Do you need to make something bigger, better, or stronger? Then you need to ______ it. To ______ is to increase the amount or strength of something.	very hard	augment	0	['augment', 'dubious', 'forthcoming', 'innocuous']
Fill the gaps:  To ______ is to remove or find by digging. If you have rocky soil in your garden, you may have to ______ it to remove the rocks and replace them with additional soil.	very hard	excavate	2	['elusive', 'marked', 'excavate', 'torrent']
Fill the gaps:  To ______ is to confuse. If you are completely puzzled as to what ______ means, you might say that this word ______s you.	very hard	baffle	1	['barter', 'baffle', 'trivial', 'so-called']
Fill the gaps:  Something ______ is perfectly appropriate, clever and well-suited to the matter at hand. If your room is small and dark, “cave-like” would be an ______ description.	very hard	apt	0	['apt', 'despondent', 'pretext', 'banish']
Fill the gaps:  ______ describes a person who has been around forever, doing what they do, and doing it well — throughout the seasons. They have lots of experience, and they can handle just about anything that comes their way.	very hard	seasoned	1	['despondent', 'seasoned', 'fuse', 'paramount']
Fill the gaps:  See ______, think "calm." It could be the noun form (like "the ______ before the storm") or the verb: one can ______ someone by calming them (as to ______ a baby to sleep).	very hard	lull	3	['feeble', 'fleeting', 'spearhead', 'lull']
Fill the gaps:  To ______ is to get rid of or annul. So when the principal yells at you for the 100th time for not having your shirt tucked in, it's safe to wish they'd just ______ the silly dress code.	very hard	abolish	1	['dwelling', 'abolish', 'fleeting', 'arid']
Fill the gaps:  A ______ is a name that someone, often a writer, uses instead of their real name. The real name of Dr. Seuss was Theodore Seuss Geisel. Mark Twain was a ______ for the writer Samuel Clemens.	very hard	pseudonym	3	['involved', 'convene', 'inept', 'pseudonym']
Fill the gaps:  To ______ is to use a physical gesture to call someone over to you. Universally recognized gestures used to ______ include crooking the finger or nodding the head to  invite someone over.	very hard	beckon	2	['arid', 'cope', 'beckon', 'facet']
Fill the gaps:  If something is ______, it's famous. Your town's ______ restaurant — the one everybody knows and talks about — might be a modest barbecue joint.	very hard	celebrated	1	['overshadow', 'celebrated', 'gaudy', 'overlook']
Fill the gaps:  The verb ______ means to block or put something in the way of, so if you’re in a high-speed car chase with the police, they might put up a blockade to ______ your progress.	very hard	hinder	0	['hinder', 'prose', 'erratic', 'elective']
Fill the gaps:  ______ is the act or state of fighting or arguing violently. The years leading up to the U.S. Civil War were characterized by great ______ between northern and southern states over slavery and the role of a federal government.	very hard	strife	2	['forthcoming', 'salvage', 'strife', 'urbane']
Fill the gaps:  The verb ______ means to give up or lose the right to something.	very hard	forgo	0	['forgo', 'minute', 'nuance', 'telling']
Fill the gaps:  ______ means showing no mercy or compassion. If you really want to cut down on the clutter in your apartment, you can't be sentimental about keepsakes. You have to be ______ and throw out everything that's not absolutely essential.	very hard	ruthless	2	['lure', 'apex', 'ruthless', 'notwithstanding']
Fill the gaps:  A clumsy, incompetent person — or an ineffective action — is ______. When you're ______, you don't know what you're doing or just can't get it done.	very hard	inept	3	['notwithstanding', 'marked', 'grueling', 'inept']
Fill the gaps:  A villain's worst nightmare is the superhero who always seems to ______ his efforts, preventing him from carrying out his plans to take over the world.	very hard	thwart	2	['advent', 'wares', 'thwart', 'lavis']
Fill the gaps:  To ______ in a home is to live in it. To ______ on something — usually something bad, like a failed romance or terrible service in a restaurant — is to think or speak about it at great length.	very hard	dwell	3	['exacerbate', 'drench', 'wane', 'dwell']
Fill the gaps:  To ______ is to come back from a slump. You might ______ from an illness, or your country might ______ from an economic recession.	very hard	rebound	1	['aroma', 'rebound', 'forthcoming', 'indigenous']
Fill the gaps:  When it's incalculably small, when teensy seems large compared to it, then it is ______. "The equipment was so sensitive that even the ______ dust molecules that swept in with the open door altered the readings."	very hard	infinitesimal	0	['infinitesimal', 'hinder', 'feeble', 'beckon']
Fill the gaps:  To ______ is to use up or consume a limited resource. Visiting relatives might ______ your refrigerator of food, or a pestering friend might ______ your patience.	very hard	deplete	2	['morale', 'so-called', 'deplete', 'arid']
Fill the gaps:  A ______ is a heavy rain, or the flooding or wildly-running streams it causes, like the ______ that soaks everyone unlucky enough to be out on the street at that moment.	very hard	torrent	0	['torrent', 'deplete', 'indignant', 'depress']
Fill the gaps:  Use the adjective ______ to describe behavior that's not totally honest or sincere. It's ______ when people pretend to know less about something than they really do.	very hard	disingenuous	1	['indignant', 'disingenuous', 'levy', 'notwithstanding']
Fill the gaps:  Things that are ______ are hard to find, pin down, or remember. They slip right out of your grasp.	very hard	elusive	0	['elusive', 'wares', 'disingenuous', 'propulsion']
Fill the gaps:  ______ means to leak slowly. When you see the word, imagine water coming in through your sneakers on a rainy day. It's not a lot of water, but your feet still get pretty wet.	very hard	seep	0	['seep', 'cope', 'pressing', 'telling']
Fill the gaps:  A ______ is a noise, something you can hear if you're in the right spot and it's loud enough. A doorbell, a fire alarm, a cat's meow, or your brother's snoring — they’re all ______s.	very hard	sound	1	['spearhead', 'sound', 'impetus', 'elusive']
Fill the gaps:  To ______ is to wander around looking for food. When it’s cold and snowy outside, birds may ______ for food in your backyard, digging around for whatever they can find.	very hard	forage	3	['arid', 'involved', 'notwithstanding', 'forage']
Fill the gaps:  Something that is ______ is gloomy and depressing. If it's raining and dark, you might describe the night as ______. If you have looked for work and no one will hire you, you could describe your prospects as ______.	very hard	bleak	1	['paramount', 'bleak', 'lull', 'gaudy']
Fill the gaps:  Someone or something that is ______ is fruitful or highly productive. A ______ songwriter can churn out five hit tunes before breakfast.	very hard	prolific	3	['irrefutable', 'sever', 'advent', 'prolific']
Fill the gaps:  A ______ is a moral tale that often features animal characters. “The Tortoise and the Hare” is a well-known ______ whose moral is "Slow and steady wins the race."	very hard	fable	3	['celebrated', 'hoist', 'flourish', 'fable']
Fill the gaps:  The ______ of something means that it's finally here. You might be waiting for the ______ of a new iPhone or for the ______ of cloning. Don't hold your breath.	very hard	advent	1	['paramount', 'advent', 'jeopardy', 'dwelling']
Fill the gaps:  ______ means strange and unusual in an old-fashioned and charming way. It's a word you'd use to describe a little store that sells tea cozies and antique tea services, or your grandmother's habit of calling the radio the "wireless."	very hard	quaint	1	['peril', 'quaint', 'overlook', 'juxtapose']
Fill the gaps:  A ______ is a home — where someone lives. Houses, apartments, and condos are all ______s.	very hard	dwelling	2	['abolish', 'dubious', 'dwelling', 'apt']
Fill the gaps:  If something's ______, it's very important and should be taken care of right away. Your French club's most ______ issue might be raising money for the big trip to Montreal.	very hard	pressing	3	['supplant', 'lavis', 'feeble', 'pressing']
Fill the gaps:  Describe yourself as ______ if you don't quite trust someone or something and want to proceed with caution. Be ______ of risky things like wild mushrooms and Internet deals!	very hard	wary	2	['profuse', 'drench', 'wary', 'torrent']
Fill the gaps:  If you are able to ______ with something, you are able to deal with it. If you can ______ with waiting in long lines, you'll get the best seats. If you can ______ with the stress, you will be excellent at defusing bombs.	very hard	cope	3	['catalyst', 'erratic', 'apex', 'cope']
Fill the gaps:  Something that's ______ is showy, bright and definitely tacky. So think twice about that ______ rainbow-colored suit and shiny gold shoes ensemble.	very hard	gaudy	2	['feeble', 'supplant', 'gaudy', 'torrent']
